"mpi_urls_link","mpi_urls_date_date","mpi_urls_date_user","mpi_urls_date_comments"
"https://klse.i3investor.com/servlets/forum/800000623.jsp?ftp=45","Dec 3, 2020 10:19 PM","fishchu","Another sector that was deemed the darling of investors comprise the semiconductor-related firms. This sector too has seen significant improvements in both q-o-q and y-o-y earnings performance.
Eight out of the 10 semiconductor-related companies among the top 100 firms saw double-digit growth in earnings. VS Industry Bhd returned to the black this quarter while SKP Resources Bhd saw 339.15% q-o-q growth in 3Q20. Inari Amertron Bhd (+97.53% q-o-q), Unisem (M) Bhd (+49.47% q-o-q) and Greatech Technology Bhd (+31.73% q-o-q) all saw more than 30% q-o-q growth in net profit.
On a yearly basis, Unisem managed to report a profitable quarter compared to a loss-making 3Q19. Interestingly, half of these 10 companies saw more than 50% y-o-y growth. Vitrox Corp Bhd grew 114.45% y-o-y, followed by UWC Bhd (+85.11% y-o-y), Greatech (+79.7% y-o-y), SKP Resources (+76.9% y-o-y) and Malaysian Pacific Industries Bhd (+50.32% y-o-y)."
"https://klse.i3investor.com/servlets/forum/800000623.jsp?ftp=45","Dec 5, 2020 4:19 PM","CraZY INvesTOR","coming back again.. bought at RM8 august 2019 , dint expect to go so high . only left 40 k in the freezer and now I earn almost 100K , will buy new car for my son. well done MPI"
"https://klse.i3investor.com/servlets/forum/800000623.jsp?ftp=45","Dec 11, 2020 1:28 PM","KP_RECT","What happen to the 2 days continuous drop ?"
"https://klse.i3investor.com/servlets/forum/800000623.jsp?ftp=45","Dec 13, 2020 3:37 PM","DreamMarauder","China's chip dreams face reality check with Biden's united front approach
https://www.scmp.com/tech/policy/article/3113606/chinas-chip-dreams-fa..."
"https://klse.i3investor.com/servlets/forum/800000623.jsp?ftp=45","Dec 14, 2020 5:15 PM","pinnaclegrade","Bullish pin bar is seen today, still on an uptrend.. Going to rally further"
"https://klse.i3investor.com/servlets/forum/800000623.jsp?ftp=45","Dec 21, 2020 9:15 AM","New994","same field as unisem, unisem shinning! MPI coming!!"
"https://klse.i3investor.com/servlets/forum/800000623.jsp?ftp=45","Dec 23, 2020 3:56 PM","PZOGRO","HOT!
BOSS TO GIVE BONUS ISSUE SOON!
HOT! HOT! HOT!
1:1 1:2 2:1 2:3 1:3....
WHICH ONE?
STAY TUNED GO GO GO!"
"https://klse.i3investor.com/servlets/forum/800000623.jsp?ftp=45","Dec 24, 2020 2:38 PM","pinnaclegrade","confirmed bonus issue?"
"https://klse.i3investor.com/servlets/forum/800000623.jsp?ftp=45","Dec 27, 2020 1:46 AM","solaris80","Got covid cases"
"https://klse.i3investor.com/servlets/forum/800000623.jsp?ftp=45","Dec 29, 2020 3:58 AM","scottsytong","https://www.digitimes.com/news/a20201228PD203.html?
Vendors in the US and Europe are ramping up application of third-generation semiconductor materials including SiC (silicon carbide) and GaN to 5G base stations and EVs, according to industry sources."
"https://klse.i3investor.com/servlets/forum/800000623.jsp?ftp=45","Dec 29, 2020 5:53 PM","pinnaclegrade","Sold for now, thank you for the ride MPI"
"https://klse.i3investor.com/servlets/forum/800000623.jsp?ftp=45","Dec 31, 2020 4:45 PM","wallstreetrookie","Perfect end to 2020 winner of Bursa goes to MPI. Huat ahhh best performing stock of 2020 besides gloves"
"https://klse.i3investor.com/servlets/forum/800000623.jsp?ftp=45","Jan 8, 2021 4:54 PM","New994","MPI is your safe land now. onboard!!"
"https://klse.i3investor.com/servlets/forum/800000623.jsp?ftp=45","Jan 10, 2021 1:55 PM","FortuneBlooming","What is estimate for coming qrtr pat?"
"https://klse.i3investor.com/servlets/forum/800000623.jsp?ftp=45","Jan 10, 2021 1:56 PM","FortuneBlooming","Can hit RM3.8 billion kah"
"https://klse.i3investor.com/servlets/forum/800000623.jsp?ftp=45","Jan 10, 2021 1:56 PM","FortuneBlooming","Cannot la"
"https://klse.i3investor.com/servlets/forum/800000623.jsp?ftp=45","Jan 10, 2021 1:56 PM","FortuneBlooming","Only TopGlove can la"
"https://klse.i3investor.com/servlets/forum/800000623.jsp?ftp=45","Jan 11, 2021 3:52 AM","GrowingRich","mco gonna revive awareness on covid-19 & re-trigger stronger compliance with SOPs"
"https://klse.i3investor.com/servlets/forum/800000623.jsp?ftp=45","Jan 11, 2021 3:53 AM","GrowingRich","Therefore mco gonna be good for glove stocks"
"https://klse.i3investor.com/servlets/forum/800000623.jsp?ftp=45","Jan 11, 2021 3:54 AM","GrowingRich","Minister Mustapa Mohamad tests positive for covid-19
https://www.thestar.com.my/news/nation/2021/01/10/tok-pa-tests-positiv..."
"https://klse.i3investor.com/servlets/forum/800000623.jsp?ftp=45","Jan 11, 2021 4:53 PM","New994","cheapest tech stock"
"https://klse.i3investor.com/servlets/forum/800000623.jsp?ftp=45","Jan 13, 2021 3:21 PM","New994","soon 30ringgit then ppl start to come in ask can buy?"
"https://klse.i3investor.com/servlets/forum/800000623.jsp?ftp=45","Jan 13, 2021 3:52 PM","Fireplume","dawchok pocket deep deep.. so many lots.. now happy taking profit.."
"https://klse.i3investor.com/servlets/forum/800000623.jsp?ftp=45","Jan 13, 2021 4:13 PM","wallstreetrookie","Bruh seriously you think this is your personal forum is it? No one cares you sold how many lots and at what price. Jesus Christ get a life or have sex with your wife at least do something else la"
"https://klse.i3investor.com/servlets/forum/800000623.jsp?ftp=45","Jan 13, 2021 4:14 PM","wallstreetrookie","This guy atuk liao I guess. Sell how many lots also need to tell people"
"https://klse.i3investor.com/servlets/forum/800000623.jsp?ftp=45","Jan 13, 2021 7:17 PM","wallstreetrookie","I sold all liao bye"
"https://klse.i3investor.com/servlets/forum/800000623.jsp?ftp=45","Jan 14, 2021 2:23 PM","New994","TA TP 29.20 first target and good for now, once the Feb qr out TP will increase lagi banyak!"
"https://klse.i3investor.com/servlets/forum/800000623.jsp?ftp=45","Jan 14, 2021 2:33 PM","apolloang","potato pang di sini buat apa….foodpanda driver got money to buy meh this heavyweight? hehe"
"https://klse.i3investor.com/servlets/forum/800000623.jsp?ftp=45","Jan 14, 2021 5:04 PM","CraZY INvesTOR","bila nak bonus issue banggg"
"https://klse.i3investor.com/servlets/forum/800000623.jsp?ftp=45","Jan 15, 2021 5:57 PM","IvanC","Next week break rm30 :)"
"https://klse.i3investor.com/servlets/forum/800000623.jsp?ftp=45","Jan 17, 2021 7:05 AM","PureBULL ...","Days ago, report said TSLA made its owner the richest man on earth.
TSLA had sold 500,000 EV cars in 2020. These # r counting up exponentially, confirmed n affirmed. BYD n NIO r having fun too.
EV economy is just getting started. old cars can become obsolete n EV is the choice.
EV car material co in the supply chain will grow very fast into GIANT co !
Position early for this huge giant WAVE for the long haul, we must ...
Watch out for PMBTECH, PMETAL, D&O, UNISEM, MPI etc ...
https://finance.yahoo.com/news/bmw-aims-double-fully-electric-16485408...
Join this happening Te le gram group. You can learn the knowhow of many sifu with time proven strategies n tactics for today's mkt at: greatstockinvestors"
"https://klse.i3investor.com/servlets/forum/800000623.jsp?ftp=45","Jan 18, 2021 9:11 AM","wallstreetrookie","pang72 only comments when a stock is going up what a clown"
"https://klse.i3investor.com/servlets/forum/800000623.jsp?ftp=45","Jan 18, 2021 9:16 AM","New994","hahah it is ok, as long as stock price increase everyone is happy. Later over RM30 only people start asking can still buy???"
"https://klse.i3investor.com/servlets/forum/800000623.jsp?ftp=45","Jan 18, 2021 10:56 AM","New994","Can buy now?"
"https://klse.i3investor.com/servlets/forum/800000623.jsp?ftp=45","Jan 18, 2021 3:33 PM","Fireplume","Huat boss Pang. I can only used my milo tin fund which earned from sell old newspapers and tins to sailang MPI since last year..hope I can earn a few MCD meals in return."
"https://klse.i3investor.com/servlets/forum/800000623.jsp?ftp=45","Jan 18, 2021 11:19 PM","apolloang","u only got this? I tot u own nestle too.....hahaha"
"https://klse.i3investor.com/servlets/forum/800000623.jsp?ftp=45","Jan 21, 2021 4:20 PM","apple168",""
"https://klse.i3investor.com/servlets/forum/800000623.jsp?ftp=45","Jan 22, 2021 6:02 PM","Michael Kwok","Putting upgrade to Rm 40 range.Still got meat.Buying price 29.50-rm 30.Increasing profit for 2 quarter,High demand in chips,Not consider overvalue due to IR."
"https://klse.i3investor.com/servlets/forum/800000623.jsp?ftp=45","Jan 23, 2021 11:48 AM","apple168","Be fearful when others are greedy and to be greedy only when others are fearful— Warren Buffett"
"https://klse.i3investor.com/servlets/forum/800000623.jsp?ftp=45","Jan 23, 2021 6:21 PM","apple168","Based on our big data, this was the last wave for tech stocks to escape! Good Luck!"
"https://klse.i3investor.com/servlets/forum/800000623.jsp?ftp=45","Jan 23, 2021 10:02 PM","Michael Kwok","I upgrade first.IR due to means industrial revolution 4.Bank usually slower and when up already then upgrade from majority of the bank.Pang 72,u to not notice I write I have so many TP reach.From normal stocks to to potential stocks.Not all on the FA side.Its also on the TA side.
Michael Kwok
2980 posts
Posted by Michael Kwok > Jan 22, 2021 6:02 PM | Report Abuse X
Putting upgrade to Rm 40 range.Still got meat.Buying price 29.50-rm 30.Increasing profit for 2 quarter,High demand in chips,Not consider overvalue due to IR."
"https://klse.i3investor.com/servlets/forum/800000623.jsp?ftp=45","Jan 24, 2021 4:59 PM","apple168","https://www.sinchew.com.my/content/content_2416542.html"
"https://klse.i3investor.com/servlets/forum/800000623.jsp?ftp=45","Jan 24, 2021 4:59 PM","apple168","Back to below 10!"
"https://klse.i3investor.com/servlets/forum/800000623.jsp?ftp=45","Jan 25, 2021 9:01 AM","apple168","In MCO, do you see ppl selling tissue paper or cigarettes in the street? Even the local can’t go to do facial and hair cut in MCO! Many of the local are going to face retrenchment! With this, the local face difficulties in serving car loan or housing loan and credit card debt. Do you think they will hv money to buy luxury car equipped with latest electronic devices!? Makan pun tak cukup!"
"https://klse.i3investor.com/servlets/forum/800000623.jsp?ftp=45","Jan 25, 2021 9:03 AM","apple168","MPI is falling down, falling down, falling down; MPI is falling down; my dear friend!"
"https://klse.i3investor.com/servlets/forum/800000623.jsp?ftp=45","Jan 25, 2021 9:14 AM","apple168","Remember 99% of shares will crash in this COVID-19 economic crisis! Your survival rate is only 1%! Good Luck!"
"https://klse.i3investor.com/servlets/forum/800000623.jsp?ftp=45","Jan 25, 2021 11:19 AM","apple168","Once upon a time, a rich man from the city arrived in a village. He announced to the villagers that he would buy Monkeys for 100 each.
The villagers were very happy, after all there were hundreds of Monkeys in a nearby forest.
They caught the Monkeys and got them to the rich man. He bought hundreds of Monkeys and paid 100 for every Monkey the villagers gave him.
They began to make a living out of getting Monkeys from the forest and selling it to the rich man.
Soon, the forest began to run out of monkeys that were easy to catch.
Sensing this, the rich man offers 200 for every monkey. The villagers were ecstatic.
They went back to the forest, set up traps and caught the monkeys and got them to the rich man.
A few days later, the rich man announced he would pay 300 per monkey.
The villagers began climbing trees and risking their lives to catch monkeys and get them to the rich man – who bought them all.
There were no Monkeys left in the forest!
One day, the rich man announced he would like to buy more monkeys – this time for 800 each.
The villagers couldn’t believe this. They were desperately trying to get more monkeys.
Meanwhile, the rich man said he had to go back to the city on some business work and until he returns his manager would deal on his behalf.
Once he left, the villagers were unhappy. They were making quick and easy money from selling monkeys, but the forest no longer had monkeys.
This is when the manager of the rich man stepped in.
He made an offer the villagers could not refuse.
Pointing out to all the monkeys that the rich man had caged. He told the villagers he would sell the monkeys for 400 each.
“Sell them back to the rich man at 800 each when he comes back” the manager said.
The villagers were over the moon. Buy for 400 and sell for 800 in few days. They had just found the easiest way to double their money.
The villagers collected all their savings and even borrowed money.
There were long queues and within a few hours, almost all the monkeys were sold out.
Unfortunately, their happiness did not last long, as the manager went missing the next day and the rich man never came back.
Many villagers kept the monkeys with them, hoping the rich man would come back. But soon, they lost hope and had to let the monkeys back into the forest as feeding and taking care of the noisy monkeys became extremely difficult.
Good Luck!"
"https://klse.i3investor.com/servlets/forum/800000623.jsp?ftp=45","Jan 25, 2021 3:48 PM","Fc78020","crazy strong stock"
"https://klse.i3investor.com/servlets/forum/800000623.jsp?ftp=45","Jan 25, 2021 6:20 PM","Michael Kwok","U see my target to buy also right.My upgrade also supported by CIMB.Please read.
https://www.theedgemarkets.com/article/cgscimb-upgrades-semiconductor-...
Posted by Michael Kwok > Jan 23, 2021 10:02 PM | Report Abuse X
I upgrade first.IR due to means industrial revolution 4.Bank usually slower and when up already then upgrade from majority of the bank.Pang 72,u to not notice I write I have so many TP reach.From normal stocks to to potential stocks.Not all on the FA side.Its also on the TA side.
Michael Kwok
2980 posts
Posted by Michael Kwok > Jan 22, 2021 6:02 PM | Report Abuse X
Putting upgrade to Rm 40 range.Still got meat.Buying price 29.50-rm 30.Increasing profit for 2 quarter,High demand in chips,Not consider overvalue due to IR."
"https://klse.i3investor.com/servlets/forum/800000623.jsp?ftp=45","Jan 25, 2021 11:00 PM","ming23","MPI Hit new high today but if we consider base on the fundamental. The share price still have alots of upside potential. PE is only 30+ compare with Unisem, JF tech which is PE 100X"
"https://klse.i3investor.com/servlets/forum/800000623.jsp?ftp=46","Jan 26, 2021 8:27 AM","apple168","https://hk.finance.yahoo.com/news/高點到-中國國家級基金宣布減碼半導體類股-030112526.html"
"https://klse.i3investor.com/servlets/forum/800000623.jsp?ftp=46","Jan 26, 2021 9:06 AM","New994","Soon bonus issue?"
"https://klse.i3investor.com/servlets/forum/800000623.jsp?ftp=46","Jan 26, 2021 2:04 PM","amateurJR","Walao! This is the really known as ""Shi Bu Ke Dang"" !"
"https://klse.i3investor.com/servlets/forum/800000623.jsp?ftp=46","Jan 26, 2021 7:52 PM","Michael Kwok","I write first with TP.CiMB no TP."
"https://klse.i3investor.com/servlets/forum/800000623.jsp?ftp=46","Jan 26, 2021 9:16 PM","Michael Kwok","On tht next day it can buy on range price.
Posted by Michael Kwok > Jan 22, 2021 6:02 PM | Report Abuse X
Putting upgrade to Rm 40 range.Still got meat.Buying price 29.50-rm 30.Increasing profit for 2 quarter,High demand in chips,Not consider overvalue due to IR."
"https://klse.i3investor.com/servlets/forum/800000623.jsp?ftp=46","Jan 27, 2021 10:02 AM","goreng_kaki","BIG bubble going to burst"
"https://klse.i3investor.com/servlets/forum/800000623.jsp?ftp=46","Jan 27, 2021 10:10 AM","New994","Burst burst hahaha shouting from 20plus till now. one day confirm will burst"
"https://klse.i3investor.com/servlets/forum/800000623.jsp?ftp=46","Jan 27, 2021 11:54 AM","CoolJay","so high...."
"https://klse.i3investor.com/servlets/forum/800000623.jsp?ftp=46","Jan 27, 2021 6:14 PM","Michael Kwok","If u all know how to see the chart.Then u all know.Not bursting.Chip in demand.China need it,Europe need it,American continent need it.Due to ramp up production after last year delay."
"https://klse.i3investor.com/servlets/forum/800000623.jsp?ftp=46","Jan 28, 2021 10:14 PM","soonheng","MPI engaged in manufacturing, assembling, testing and sale of integrated circuits, semiconductor devices, electronic components and leadframes."
"https://klse.i3investor.com/servlets/forum/800000623.jsp?ftp=46","Jan 28, 2021 10:14 PM","soonheng","MPI driven by its strategy to ramp up power management packages for EVs and servers in data , RFFE modules and sensor products."
"https://klse.i3investor.com/servlets/forum/800000623.jsp?ftp=46","Jan 28, 2021 10:14 PM","soonheng","Carsem is primed to benefit from growing demand for local semiconductor service providers"
"https://klse.i3investor.com/servlets/forum/800000623.jsp?ftp=46","Jan 28, 2021 10:15 PM","soonheng","Carsem Semiconductor (Suzhou) .
Manufacturing and testing of semiconductor devices and electronic components"
"https://klse.i3investor.com/servlets/forum/800000623.jsp?ftp=46","Jan 28, 2021 10:15 PM","soonheng","Carsem (Malaysia)
Manufacturing and testing of semiconductor devices and electronic components"
"https://klse.i3investor.com/servlets/forum/800000623.jsp?ftp=46","Jan 28, 2021 10:15 PM","soonheng","Dynacraft Industries
Manufacturing and sale of leadframes"
"https://klse.i3investor.com/servlets/forum/800000623.jsp?ftp=46","Jan 29, 2021 12:07 PM","apple168","When Apple itself hv no confidence on tech shares, you better sell when price still good!"
"https://klse.i3investor.com/servlets/forum/800000623.jsp?ftp=46","Jan 29, 2021 8:21 PM","apple168","Covid-19 new cases broke 5000, stand that highest in a day of 5718 new cases in Malaysia, two weeks faster than expected!"
"https://klse.i3investor.com/servlets/forum/800000623.jsp?ftp=46","Jan 30, 2021 8:27 AM","apple168","我是发菩提心，对小投资者做风险提醒：
1. Dow Jones future 和 KLSE in bearish trend!
2. 科技龙头的漂亮财无法推高股价，比如apple财报公布后跌最多，收入盈利都创新高，可是股价却向南跌，跌跌不休。
3. Malaysia COVID-19 疫情每况愈下，屡创新高，不久的将来、COVID-19 就在你左右，当你的家人因COVID-19往生，政府还不承认错误，加强MCO，赢了股票，坐满一车车的金银珠宝，输掉自己的家人，你还会开心吗？要知道亡者没得净身，没得穿上喜爱华丽的服装，要以最快的速度将遗体入棺，直接封棺，之后就直接送去火化或下葬，连送最后一程，也只能两三个亲人，因为处于高风险，是不允许太多人送最后一程。况且每个家庭成员都必须去检验，有些还在隔离着。我相信这些种种凄凉和悲哀的过程，我们都不想遇到这样的死亡吧！所以在此提醒大家，COVID-19 真的不是开玩笑的，不要以为不会发生在自己的身上，为了自己、家人、亲友们的安全和健康，没必要真的少出门，千万要记得带好口罩、勤洗手、保持社交距离真的很重要，别再赌股票，赌运气，收割下雨财为上，阿弥陀佛，我们离股灾已不远了。"
"https://klse.i3investor.com/servlets/forum/800000623.jsp?ftp=46","Feb 2, 2021 1:03 PM","Diogo_Jota","Still going strong. Huat"
"https://klse.i3investor.com/servlets/forum/800000623.jsp?ftp=46","Feb 2, 2021 3:32 PM","GreatGreatech","Regret not buying more when it was rm8"
"https://klse.i3investor.com/servlets/forum/800000623.jsp?ftp=46","Feb 2, 2021 4:34 PM","troy88","Strong and steady. Can sleep tight this counter."
"https://klse.i3investor.com/servlets/forum/800000623.jsp?ftp=46","Feb 2, 2021 5:38 PM","Diogo_Jota","This apple fella want scare people to collect their tickets hahaha.
So i know who to watchout for. Haha"
"https://klse.i3investor.com/servlets/forum/800000623.jsp?ftp=46","Feb 3, 2021 10:04 AM","troy88","Went up so fast no time to top up. Wow!"
"https://klse.i3investor.com/servlets/forum/800000623.jsp?ftp=46","Feb 3, 2021 5:15 PM","morganlee","quietly heading 40."
"https://klse.i3investor.com/servlets/forum/800000623.jsp?ftp=46","Feb 4, 2021 9:24 AM","troy88","Will eventually become like Dutch Lady a few years ago when it was in it's glory days."
"https://klse.i3investor.com/servlets/forum/800000623.jsp?ftp=46","Feb 4, 2021 12:03 PM","Diogo_Jota","Steady hold, dont dump.
PE all still good, 2021 QR sure favourable with demand from China"
"https://klse.i3investor.com/servlets/forum/800000623.jsp?ftp=46","Feb 4, 2021 12:12 PM","troy88","Yes, hold. This is not a goreng stock. Long term holders will be rewarded handsomely."
"https://klse.i3investor.com/servlets/forum/800000623.jsp?ftp=46","Feb 4, 2021 3:06 PM","Diogo_Jota","https://eresearchsystem.bursamalaysia.com/eResearch/webdownload.pub?id..."
"https://klse.i3investor.com/servlets/forum/800000623.jsp?ftp=46","Feb 4, 2021 8:37 PM","cch94076","tesla is Cree's customer, Cree is MPI's customer"
"https://klse.i3investor.com/servlets/forum/800000623.jsp?ftp=46","Feb 5, 2021 12:48 AM","Diogo_Jota","Target RM2 billion revenue, for 2021.
See whether the production can meet the demand.
Revenue has been increase every quarter."
"https://klse.i3investor.com/servlets/forum/800000623.jsp?ftp=46","Feb 5, 2021 2:30 AM","L2earn","https://www.greencarcongress.com/2021/01/20210121-cree.html
Cree delivers industry leading efficiency to EV fast charging & solar markets with new SiC power module portfolio
21 January 2021"
"https://klse.i3investor.com/servlets/forum/800000623.jsp?ftp=46","Feb 5, 2021 2:06 PM","Stockisnotfun","Wah this one slowly up. Steady"
"https://klse.i3investor.com/servlets/forum/800000623.jsp?ftp=46","Feb 5, 2021 4:57 PM","troy88","MPI always steady. Solid stock for serious investors.."
"https://klse.i3investor.com/servlets/forum/800000623.jsp?ftp=46","Feb 9, 2021 12:53 AM","Sipekhuat",""
"https://klse.i3investor.com/servlets/forum/800000623.jsp?ftp=46","Feb 9, 2021 10:34 AM","New994","expecting new high today!"
"https://klse.i3investor.com/servlets/forum/800000623.jsp?ftp=46","Feb 9, 2021 10:39 AM","troy88","Just hold tight and sleep tight. Slow and steady for the king of tech stocks!"
"https://klse.i3investor.com/servlets/forum/800000623.jsp?ftp=46","Feb 9, 2021 10:40 AM","ahsoon","chip shortage"
"https://klse.i3investor.com/servlets/forum/800000623.jsp?ftp=46","Feb 9, 2021 12:02 PM","CoolJay","only bankers will play this"
"https://klse.i3investor.com/servlets/forum/800000623.jsp?ftp=46","Feb 9, 2021 10:11 PM","CoolJay","buy 10 lot also can earn nice nice dy"
"https://klse.i3investor.com/servlets/forum/800000623.jsp?ftp=46","Feb 9, 2021 10:44 PM","Jfinancetech","Just wait for tomorrow, great performance ahead."
"https://klse.i3investor.com/servlets/forum/800000623.jsp?ftp=46","Feb 9, 2021 11:29 PM","STEADYBOMBIBI85",""
"https://klse.i3investor.com/servlets/forum/800000623.jsp?ftp=46","Feb 10, 2021 2:13 AM","Trouble Huat","whenever pang72 promote, the stock will going to downtrend"
"https://klse.i3investor.com/servlets/forum/800000623.jsp?ftp=46","Feb 10, 2021 3:02 PM","Diogo_Jota","Chance to collect more. All need money for CNY."
"https://klse.i3investor.com/servlets/forum/800000623.jsp?ftp=46","Feb 11, 2021 10:36 AM","troy88","AMD's CEO Lisa Su even said chip shortage will likely last for the whole of 2021. The way we live is going to be very different in this 202X decade and for decades to come. Tech is going to be a very big part of our lives."
"https://klse.i3investor.com/servlets/forum/800000623.jsp?ftp=46","Feb 11, 2021 11:19 AM","troy88","MPI has already beaten Dutch Lady currently and will beat Dutch Lady when it was at it's peak of RM70 eventually."
"https://klse.i3investor.com/servlets/forum/800000623.jsp?ftp=46","Feb 11, 2021 11:22 AM","Fundamental123","Hi Guys,
Do you believe in Malaysia Pensonic and Khind products which have smart device and competitive in production cost ? Take note these two counters:)
Good luck !
https://www.pensonic.com/products2/product-group-3/toush1/item/3021-to..."
"https://klse.i3investor.com/servlets/forum/800000623.jsp?ftp=46","Feb 11, 2021 11:24 AM","huat8787","Wa..major shareholder and boss keep dispose"
"https://klse.i3investor.com/servlets/forum/800000623.jsp?ftp=46","Feb 11, 2021 12:03 PM","CoolJay","wah... suddenly up so much"
"https://klse.i3investor.com/servlets/forum/800000623.jsp?ftp=46","Feb 11, 2021 12:07 PM","Fundamental123","Has broken RM39.00 and well done!"
"https://klse.i3investor.com/servlets/forum/800000623.jsp?ftp=46","Feb 11, 2021 12:08 PM","troy88","Almost within touching distance to RM40. Thanks for the ang pow MPI."
"https://klse.i3investor.com/servlets/forum/800000623.jsp?ftp=47","Feb 11, 2021 12:10 PM","Fundamental123","D&O has been performing extremely well ."
"https://klse.i3investor.com/servlets/forum/800000623.jsp?ftp=47","Feb 11, 2021 12:26 PM","Diogo_Jota","Congrats to those hold tightly this counter."
"https://klse.i3investor.com/servlets/forum/800000623.jsp?ftp=47","Feb 11, 2021 1:24 PM","Michael Kwok","Please do not take my credit.Im the one who writes above rm 40 first.Tht guy change few times to Mandarin.The blogger itself.
Posted by Michael Kwok > Jan 26, 2021 9:16 PM | Report Abuse
On tht next day it can buy on range price.
Posted by Michael Kwok > Jan 22, 2021 6:02 PM | Report Abuse X
Putting upgrade to Rm 40 range.Still got meat.Buying price 29.50-rm 30.Increasing profit for 2 quarter,High demand in chips,Not consider overvalue due to IR."
"https://klse.i3investor.com/servlets/forum/800000623.jsp?ftp=47","Feb 11, 2021 3:19 PM","shearer202","Every millionaires in MPI counter also can consider win some money from the cheapest semicon tech stock dnex now , small invest with huge gain coming soon !"
"https://klse.i3investor.com/servlets/forum/800000623.jsp?ftp=47","Feb 12, 2021 9:24 AM","TrumpJr",""
"https://klse.i3investor.com/servlets/forum/800000623.jsp?ftp=47","Feb 13, 2021 4:55 PM","Alifhafid","Dnex chepaest semicndctr counter..thinking to invest in dnex soon"
