"mpi_urls_link","mpi_urls_date_date","mpi_urls_date_user","mpi_urls_date_comments"
"https://klse.i3investor.com/servlets/forum/800000623.jsp?ftp=35","Nov 30, 2018 5:03 PM","trulyinvest","sold 10.08"
"https://klse.i3investor.com/servlets/forum/800000623.jsp?ftp=35","Nov 30, 2018 5:34 PM","TYS_Capital","seriously , you guys must cut loss."
"https://klse.i3investor.com/servlets/forum/800000623.jsp?ftp=35","Nov 30, 2018 10:44 PM","trulyinvest","Mpi out of shariah compliant list. Islamic funds unload"
"https://klse.i3investor.com/servlets/forum/800000623.jsp?ftp=35","Dec 1, 2018 9:28 AM","firehawk","too much cash causes syahriah not compliant?
Long George Share price dipped 10% after being removed from shariah compliant list. Apparently their cash to total asset is beyond 33% hence not shariah compliant. Hmmm
30/11/2018 16:53"
"https://klse.i3investor.com/servlets/forum/800000623.jsp?ftp=35","Dec 1, 2018 10:11 AM","zekuan","Huh....like this also can cause price dropped more than satu ringgit?? Wah....."
"https://klse.i3investor.com/servlets/forum/800000623.jsp?ftp=35","Dec 2, 2018 11:21 AM","RainT","Sell at rm12 now buy back again riding on the growth"
"https://klse.i3investor.com/servlets/forum/800000623.jsp?ftp=35","Dec 2, 2018 11:22 AM","RainT","Why on Friday drop so much ???
Stupid yet common question...lol"
"https://klse.i3investor.com/servlets/forum/800000623.jsp?ftp=35","Dec 2, 2018 11:23 AM","RainT","I see
Loss shariah compliance....so it's good buy ...fundamental still intact"
"https://klse.i3investor.com/servlets/forum/800000623.jsp?ftp=35","Dec 2, 2018 11:23 AM","RainT","Drop more will collect again"
"https://klse.i3investor.com/servlets/forum/800000623.jsp?ftp=35","Dec 2, 2018 9:24 PM","kjyang","Epf still buying"
"https://klse.i3investor.com/servlets/forum/800000623.jsp?ftp=35","Dec 3, 2018 9:06 PM","tecpower","Trump tweets China to cut tax on US-made cars, revs up auto stocks
https://www.cnbc.com/2018/12/03/trump-tweets-china-to-cut-tax-on-us-ma..."
"https://klse.i3investor.com/servlets/forum/800000623.jsp?ftp=35","Dec 3, 2018 9:24 PM","tecpower","Morgan Stanley upgrades Chinese stocks after ""better-than-expected"" G20 outcome. https://www.reuters.com/article/china-markets-stocks-upgrade/morgan-st..."
"https://klse.i3investor.com/servlets/forum/800000623.jsp?ftp=35","Dec 3, 2018 11:09 PM","tecpower","The PHLX semiconductor infex is extremely bullish today"
"https://klse.i3investor.com/servlets/forum/800000623.jsp?ftp=35","Dec 4, 2018 11:06 PM","tecpower","Global Semiconductor Sales Increase 12.7 Percent Year-to-Year in October; Double-Digit Annual Growth Projected for 2018.
https://www.design-reuse.com/news/45253/october-2018-worlwide-semicond..."
"https://klse.i3investor.com/servlets/forum/800000623.jsp?ftp=35","Dec 5, 2018 10:54 PM","hstha","Malaysia records highest trade surplus as exports surge in October | https://www.klsescreener.com/v2/news/view/465618"
"https://klse.i3investor.com/servlets/forum/800000623.jsp?ftp=35","Dec 5, 2018 10:57 PM","hstha","China says it'll quickly implement trade agreements with US | https://www.klsescreener.com/v2/news/view/465432"
"https://klse.i3investor.com/servlets/forum/800000623.jsp?ftp=35","Dec 5, 2018 10:59 PM","hstha","半導體銷售持續火紅 科技領域前景仍光明 | https://www.klsescreener.com/v2/news/view/465760"
"https://klse.i3investor.com/servlets/forum/800000623.jsp?ftp=35","Dec 9, 2018 1:53 PM","RainT","Need wait and patience for this
2019 also should be bad for MPI ..need wait 2020, 2021"
"https://klse.i3investor.com/servlets/forum/800000623.jsp?ftp=35","Dec 13, 2018 7:58 PM","RainT","MPI or KESM ????
Which one is better?"
"https://klse.i3investor.com/servlets/forum/800000623.jsp?ftp=35","Dec 14, 2018 10:23 PM","talim1027","MPI"
"https://klse.i3investor.com/servlets/forum/800000623.jsp?ftp=35","Dec 16, 2018 12:44 AM","RainT","@talim1027
Can share why? Just some simple reasons
Because I feel that KESM also not bad due to they focus on automotive which is going forward in future, many cars will involved smart cars and now KESM have drop the share price near its NTA value already
Thanks"
"https://klse.i3investor.com/servlets/forum/800000623.jsp?ftp=35","Dec 17, 2018 12:18 PM","enning22","ALERT :companies with their manufacturing arm in China , are deeply suffering,
(1) due to many tax laws put in force by chinese communist government,（五险一金）
(2)and effect of trade war between china and america,（贸易战） plunged the consumers market in China enters into deep contraction.
reports indicate 5 million small and media companies declared bankrupt in China ,Kuantung/Shenzhen Province for last 10 months alone."
"https://klse.i3investor.com/servlets/forum/800000623.jsp?ftp=35","Dec 24, 2018 2:57 PM","lching","RainT, i think MPI is more diversified in terms of product base n customer n KESM is more focus. if u can only buy 1 semicon stock MPI should be the one."
"https://klse.i3investor.com/servlets/forum/800000623.jsp?ftp=35","Dec 26, 2018 11:46 PM","RainT","@Iching
thanks very much for sharing your insight ! Appreciate it"
"https://klse.i3investor.com/servlets/forum/800000623.jsp?ftp=35","Jan 3, 2019 11:40 AM","RainT","well supported & steady
when INARI & GTRONIC lau sai"
"https://klse.i3investor.com/servlets/forum/800000623.jsp?ftp=35","Jan 27, 2019 7:37 AM","LouiseS","Last 5 years EPS on increasing trend, increased by 68.1% over last 5 years, PE ratio is 14, ROE 10%, and dividend yield 2.87%
https://louisesinvesting.blogspot.com/2019/01/preliminary-screening-of..."
"https://klse.i3investor.com/servlets/forum/800000623.jsp?ftp=35","Jan 30, 2019 11:56 AM","RainT","wah MPI qtr result will out anytime soon
either today or tomorrow"
"https://klse.i3investor.com/servlets/forum/800000623.jsp?ftp=35","Jan 30, 2019 11:58 AM","Fantasia","hope its good news"
"https://klse.i3investor.com/servlets/forum/800000623.jsp?ftp=35","Jan 31, 2019 5:04 PM","RainT","today last day
why MPI result still not yet announce ?"
"https://klse.i3investor.com/servlets/forum/800000623.jsp?ftp=35","Feb 15, 2019 7:41 PM","sampah","Because LENO stucked in INSAS"
"https://klse.i3investor.com/servlets/forum/800000623.jsp?ftp=35","Feb 18, 2019 3:25 PM","Warren Chan","Why is the price stagnant around RM10"
"https://klse.i3investor.com/servlets/forum/800000623.jsp?ftp=35","Feb 18, 2019 7:08 PM","Lioncity","Qtr will be out this coming Thursday"
"https://klse.i3investor.com/servlets/forum/800000623.jsp?ftp=35","Feb 21, 2019 6:02 PM","RainT","result out
PBT is better year on year
sales drop"
"https://klse.i3investor.com/servlets/forum/800000623.jsp?ftp=35","Feb 21, 2019 6:03 PM","RainT","normal quarter result , no bad & also no good"
"https://klse.i3investor.com/servlets/forum/800000623.jsp?ftp=35","Feb 21, 2019 6:36 PM","RainT","quarter report hinted will have softer demand, going forward few quarters not looking good"
"https://klse.i3investor.com/servlets/forum/800000623.jsp?ftp=35","Apr 4, 2019 12:37 PM","minigiant","EPF buying all the time."
"https://klse.i3investor.com/servlets/forum/800000623.jsp?ftp=35","Apr 5, 2019 5:46 PM","apple168","KESM drop till lau sai... surprisingly MPI still holding... hmmm...."
"https://klse.i3investor.com/servlets/forum/800000623.jsp?ftp=35","Apr 23, 2019 2:35 PM","RainT","so quiet here....."
"https://klse.i3investor.com/servlets/forum/800000623.jsp?ftp=35","May 13, 2019 11:06 PM","apple168","Nasdaq dropped 250 points!"
"https://klse.i3investor.com/servlets/forum/800000623.jsp?ftp=35","May 17, 2019 12:35 PM","RainT","continue down trend
back quarter result coming ?
insider selling ahead ?"
"https://klse.i3investor.com/servlets/forum/800000623.jsp?ftp=35","May 20, 2019 6:45 PM","Investeye","Will see what the impact to MPI & Unisem and other IC assembly manufacturers...
Several key suppliers are reportedly cutting off Huawei after the Trump administration added the Chinese telecom equipment and smartphone giant to a trade blacklist last week. According to Bloomberg, semiconductor companies Intel, Qualcomm, Xilinx and Broadcom will no longer supply Huawei until further notice."
"https://klse.i3investor.com/servlets/forum/800000623.jsp?ftp=35","May 20, 2019 11:10 PM","shareinvestor88","MPI has factory in China. Guess if this benefit MPI"
"https://klse.i3investor.com/servlets/forum/800000623.jsp?ftp=35","May 20, 2019 11:55 PM","shareinvestor88","Huawei needs the IC. If cannot get from Us , where else to find"
"https://klse.i3investor.com/servlets/forum/800000623.jsp?ftp=35","May 21, 2019 9:21 AM","dompeilee","I never looked back after selling the last of my MPI shares bought @ 9.896 average for 12.76 on 21/9/2018..."
"https://klse.i3investor.com/servlets/forum/800000623.jsp?ftp=35","May 21, 2019 7:35 PM","Lioncity","This Thursday will release qtr report."
"https://klse.i3investor.com/servlets/forum/800000623.jsp?ftp=35","May 23, 2019 3:16 PM","dompeilee","If I had hung on to my 500 shares, will be paper loss of $573 right now..."
"https://klse.i3investor.com/servlets/forum/800000623.jsp?ftp=35","May 23, 2019 4:13 PM","RainT","very bad quarter result ahead ?
or Huawei effect?"
"https://klse.i3investor.com/servlets/forum/800000623.jsp?ftp=35","May 23, 2019 4:36 PM","RainT","now is the time u dare to buy or not
dare to be contrarian or not"
"https://klse.i3investor.com/servlets/forum/800000623.jsp?ftp=35","May 23, 2019 4:38 PM","RainT","got 2 scenario :
see the share price big drop due some news
then buy in, the next days , next next days drop even more
no buy , that price is the bottom and miss the chance to buy at that price and loss the chance to make big profits"
"https://klse.i3investor.com/servlets/forum/800000623.jsp?ftp=35","May 23, 2019 4:41 PM","RainT","in life if we can know and have certain answer on the future how good ?
will the decision to resign is good?
can found better income job than before?
new job will be happy more?
when will died?
will died due to what sickness? what accident?
buy that property is good investment ?
future the property price will go up?
many many many more …
that will not have certain answer unless the future comes ..."
"https://klse.i3investor.com/servlets/forum/800000623.jsp?ftp=36","May 23, 2019 4:58 PM","wakarimas","drop more pls, see you in rm7"
"https://klse.i3investor.com/servlets/forum/800000623.jsp?ftp=36","May 23, 2019 7:00 PM","RainT","see you in RM5.00"
"https://klse.i3investor.com/servlets/forum/800000623.jsp?ftp=36","May 23, 2019 8:02 PM","mf","Sell"
"https://klse.i3investor.com/servlets/forum/800000623.jsp?ftp=36","May 24, 2019 11:05 AM","RainT","IPO is at RM0.80?"
"https://klse.i3investor.com/servlets/forum/800000623.jsp?ftp=36","May 24, 2019 5:25 PM","RainT","no eye see this MPI"
"https://klse.i3investor.com/servlets/forum/800000623.jsp?ftp=36","May 24, 2019 6:01 PM","RainT","that s why drop a lot la MPI
quarter result like shit"
"https://klse.i3investor.com/servlets/forum/800000623.jsp?ftp=36","May 24, 2019 6:18 PM","RainT","even with drop in sales and profit
but high cash pile of MPI will sustain this company going forward"
"https://klse.i3investor.com/servlets/forum/800000623.jsp?ftp=36","May 24, 2019 6:18 PM","RainT","quarter report explanation same like no explanation
haha"
"https://klse.i3investor.com/servlets/forum/800000623.jsp?ftp=36","May 26, 2019 10:54 PM","apple168","Profits dropped 36%! Revenue also dropped 10%! See you, MPI below 5!"
"https://klse.i3investor.com/servlets/forum/800000623.jsp?ftp=36","May 27, 2019 1:18 PM","PotentialGhost","MPI below 1"
"https://klse.i3investor.com/servlets/forum/800000623.jsp?ftp=36","May 27, 2019 4:12 PM","siaoliao","see u MPI below 1"
"https://klse.i3investor.com/servlets/forum/800000623.jsp?ftp=36","May 27, 2019 4:13 PM","siaoliao","get ready load in rm1"
"https://klse.i3investor.com/servlets/forum/800000623.jsp?ftp=36","May 28, 2019 4:31 PM","RainT","strong rebound
found the bottom already , I think"
"https://klse.i3investor.com/servlets/forum/800000623.jsp?ftp=36","May 28, 2019 9:31 PM","shareinvestor88","Ya ya buy at 1.00"
"https://klse.i3investor.com/servlets/forum/800000623.jsp?ftp=36","May 30, 2019 11:31 PM","shareinvestor88","Sell TP 2"
"https://klse.i3investor.com/servlets/forum/800000623.jsp?ftp=36","May 31, 2019 3:13 PM","Wong Chee Siong","Wah, huge volume"
"https://klse.i3investor.com/servlets/forum/800000623.jsp?ftp=36","May 31, 2019 9:55 PM","apple168","道指跌超300点 美股汽车股、芯片股普跌!"
"https://klse.i3investor.com/servlets/forum/800000623.jsp?ftp=36","May 31, 2019 10:27 PM","apple168","勿谓言之不预! China revenging!"
"https://klse.i3investor.com/servlets/forum/800000623.jsp?ftp=36","Jun 1, 2019 7:34 AM","apple168","US stocks fell more than 1%, auto stocks and technology stocks were among the biggest losers, worst monthly performance this year; US oil fell nearly 5.5%; US bond yields fell sharply, and gold rose 1.5%."
"https://klse.i3investor.com/servlets/forum/800000623.jsp?ftp=36","Jun 2, 2019 9:33 AM","dompeilee","Whew! Sold my final lots @ 12.76 in September."
"https://klse.i3investor.com/servlets/forum/800000623.jsp?ftp=36","Jun 10, 2019 10:18 AM","RainT","the gap so big
sell price 8.94
buy price 8.82
gap 12 sen
low liquidity same as YSPSAH"
"https://klse.i3investor.com/servlets/forum/800000623.jsp?ftp=36","Jun 11, 2019 10:36 AM","RainT","MPI dividend going to ex on 12 june ...tomorrow"
"https://klse.i3investor.com/servlets/forum/800000623.jsp?ftp=36","Jun 11, 2019 10:49 AM","Vorster89","Collect 17 Sen 1st, up up up"
"https://klse.i3investor.com/servlets/forum/800000623.jsp?ftp=36","Jun 12, 2019 5:18 PM","Wong Chee Siong","nICE CLOSE, 8.88,发发发"
"https://klse.i3investor.com/servlets/forum/800000623.jsp?ftp=36","Jun 13, 2019 9:56 PM","apple168","http://www.enanyang.my/?p=1238336"
"https://klse.i3investor.com/servlets/forum/800000623.jsp?ftp=36","Jun 18, 2019 9:40 AM","RainT","on 14 june
the kwek related people acquire 76500 shares
this is really the buy shares or ESOS or transfer or what ?
so the insider have confident with the company ?"
"https://klse.i3investor.com/servlets/forum/800000623.jsp?ftp=36","Jun 18, 2019 9:42 AM","RainT","see the type of transaction is = ACQUIRED
so should be is they buy more MPI shares
MPI future prospect should be bright"
"https://klse.i3investor.com/servlets/forum/800000623.jsp?ftp=36","Jun 20, 2019 9:59 AM","RainT","INARI start to move
MPI still sleeping, not yet wake up"
"https://klse.i3investor.com/servlets/forum/800000623.jsp?ftp=36","Jun 20, 2019 3:32 PM","RainT","effect from tech stock in US go up ?
MPI also moving ?"
"https://klse.i3investor.com/servlets/forum/800000623.jsp?ftp=36","Jun 20, 2019 11:41 PM","RainT","18 June
they acquire big again ....."
"https://klse.i3investor.com/servlets/forum/800000623.jsp?ftp=36","Jun 21, 2019 8:29 AM","shareinvestor88","SELL SELL TP 3.00"
"https://klse.i3investor.com/servlets/forum/800000623.jsp?ftp=36","Jun 22, 2019 3:03 PM","keithtrade","BUY BUY TP 12.00"
"https://klse.i3investor.com/servlets/forum/800000623.jsp?ftp=36","Jun 23, 2019 10:08 AM","shareinvestor88","Sell Sell TP 3
why u suggest buy ??"
"https://klse.i3investor.com/servlets/forum/800000623.jsp?ftp=36","Jun 24, 2019 5:32 PM","RainT","MPI prospect is good
they are moving to more high margin product
MPI is more on smart car or smart medical devices and less on smart phones etc
going forward, the future will add more smart content on automobile and this is good for MPI to be less dependent on smart phone
other than that the trade war also will benefit MPI"
"https://klse.i3investor.com/servlets/forum/800000623.jsp?ftp=36","Jul 1, 2019 12:20 PM","shareinvestor88","SELL SELL TP 3"
"https://klse.i3investor.com/servlets/forum/800000623.jsp?ftp=36","Aug 2, 2019 4:33 PM","RainT","wah
drop to near 1 year low price
up few days ago
now drop back
seem that most counters trend now is drop and drop"
"https://klse.i3investor.com/servlets/forum/800000623.jsp?ftp=36","Aug 2, 2019 7:17 PM","dompeilee","I cashed out of this stock in 2H '18 from $10.18 till $12.76. No plans 2 re-enter soon..."
"https://klse.i3investor.com/servlets/forum/800000623.jsp?ftp=36","Aug 3, 2019 6:46 PM","RainT","@dompeilee
I feel MPI is not bad counters for hold mid to long term
why u no plan re-enter to MPI soon? is it MPI prospect is not good ?"
"https://klse.i3investor.com/servlets/forum/800000623.jsp?ftp=36","Aug 21, 2019 11:23 PM","value88","MPI seems like being forgotten, so few comments in its thread in past few months.. probably this signals it is a time to buy :)"
"https://klse.i3investor.com/servlets/forum/800000623.jsp?ftp=36","Aug 21, 2019 11:44 PM","Paktua Second","Berapa harga musang king grade A sekilo?"
"https://klse.i3investor.com/servlets/forum/800000623.jsp?ftp=36","Aug 22, 2019 5:33 PM","RainT","wait quarter result out
will have chance to buy cheap"
"https://klse.i3investor.com/servlets/forum/800000623.jsp?ftp=36","Aug 28, 2019 7:49 PM","apple168","Quarterly report out! MPI Revenue dropped 12%, interestingly profits dropped 24%! Bad bad bad!"
"https://klse.i3investor.com/servlets/forum/800000623.jsp?ftp=36","Aug 28, 2019 11:45 PM","shareinvestor88","QnQ profit up. No debt. Net cash 713m."
"https://klse.i3investor.com/servlets/forum/800000623.jsp?ftp=36","Aug 28, 2019 11:50 PM","value88","Earnings recovered QoQ albeit still lower YoY.
In general, 2H2019 is good for semiconductor industry, hope MPI's performance will also improve in tandem."
"https://klse.i3investor.com/servlets/forum/800000623.jsp?ftp=36","Aug 29, 2019 3:31 PM","RainT","Net cash can make the share price go up ?
think again"
"https://klse.i3investor.com/servlets/forum/800000623.jsp?ftp=36","Aug 31, 2019 12:30 PM","ShadowSlaYer","cash pile of RM713 mil use for accretive merger and acquisition, why won't share price go up?
Major expansion in Suzhou. The Suzhou plant, which has been running at c.93% capacity, is currently undergoing major expansion with new machines arriving in September 2019 and operations commencing in November 2019. Recall, the Suzhou division currently contributes c.30% of group revenue and is expected to climb to c.50% post-expansion
Above was taken from Kenanga's report:
https://kenanga.com.my/wp-content/uploads/2019/08/MPI-190830-CU.pdf"
"https://klse.i3investor.com/servlets/forum/800000623.jsp?ftp=36","Sep 12, 2019 12:18 PM","Icon8888","I am in"
"https://klse.i3investor.com/servlets/forum/800000623.jsp?ftp=36","Sep 12, 2019 12:29 PM","qqq3","then I also follow buy a bit................"
"https://klse.i3investor.com/servlets/forum/800000623.jsp?ftp=36","Sep 12, 2019 3:49 PM","RainT","@icon8888
you in at what price?"
"https://klse.i3investor.com/servlets/forum/800000623.jsp?ftp=36","Sep 13, 2019 9:14 AM","value88","In analyst briefing, the management guided that 2H2019 performance will be better. Its Suzhou plant's utilisation is almost full and there is plan for expanding. The reason is US ban on Huawei has driven China to source the electronic components locally and MPI's Suzhou plant is benefiting.
By 2020, MPI's stock price should recover to >RM10 per share in tandem with the improving earnings."
"https://klse.i3investor.com/servlets/forum/800000623.jsp?ftp=37","Sep 13, 2019 9:29 AM","Icon8888","880
RainT @icon8888
you in at what price?
12/09/2019 3:49 PM"
"https://klse.i3investor.com/servlets/forum/800000623.jsp?ftp=37","Sep 13, 2019 9:37 AM","qqq3","https://klse.i3investor.com/blogs/qqq3/224738.jsp
I also bought MPI"
"https://klse.i3investor.com/servlets/forum/800000623.jsp?ftp=37","Sep 13, 2019 9:39 AM","qqq3","last few months only oil and gas shares got trading interests............but OG no long term future......smart are those who pivots to technology..........."
"https://klse.i3investor.com/servlets/forum/800000623.jsp?ftp=37","Sep 13, 2019 9:41 AM","qqq3","OG really no long term future........I have read articles that says in 10 years, oil got to come down US$ 10 -US$ 20 to be competitive with renewable in cars............"
"https://klse.i3investor.com/servlets/forum/800000623.jsp?ftp=37","Sep 13, 2019 9:46 AM","Icon8888","analysts bullish about MPI, says got growth
so I dumb dumb buy"
"https://klse.i3investor.com/servlets/forum/800000623.jsp?ftp=37","Sep 13, 2019 9:49 AM","Icon8888","https://klse.i3investor.com/servlets/ptres/52083.jsp"
"https://klse.i3investor.com/servlets/forum/800000623.jsp?ftp=37","Sep 13, 2019 9:55 AM","VenFx","Sifu
How abt unisem ?
Although currently unisem slightly at higher pricing value compared to mpi.
Bith chips distribution very stable"
"https://klse.i3investor.com/servlets/forum/800000623.jsp?ftp=37","Sep 13, 2019 10:52 AM","Wong Chee Siong","Wah, above crossed SMA50, fly fly fly"
"https://klse.i3investor.com/servlets/forum/800000623.jsp?ftp=37","Sep 13, 2019 12:11 PM","qqq3","fast fast pivoting from OG to technology....MI, Penta, Vitrox, MPI........."
"https://klse.i3investor.com/servlets/forum/800000623.jsp?ftp=37","Sep 13, 2019 12:21 PM","VenFx","Why no Unisem ?
WHY ???"
"https://klse.i3investor.com/servlets/forum/800000623.jsp?ftp=37","Sep 13, 2019 12:23 PM","VenFx","Unisem low at 2.08 this morning, no interested ?"
"https://klse.i3investor.com/servlets/forum/800000623.jsp?ftp=37","Sep 13, 2019 1:00 PM","CraZY INvesTOR","can analyst report to be trust ? I always kena con by analyst, hopefully not this time"
"https://klse.i3investor.com/servlets/forum/800000623.jsp?ftp=37","Sep 14, 2019 12:54 PM","RainT","wah if oil price is USD10 - 20
AIRASIA will ahoot to the sky"
"https://klse.i3investor.com/servlets/forum/800000623.jsp?ftp=37","Sep 22, 2019 2:03 AM","shareinvestor88","SELL UNISEM TP 50c"
"https://klse.i3investor.com/servlets/forum/800000623.jsp?ftp=37","Sep 22, 2019 11:34 AM","shareinvestor88","MPI is moving into Auto sector high growth"
"https://klse.i3investor.com/servlets/forum/800000623.jsp?ftp=37","Sep 23, 2019 9:57 AM","VennesA","Any idea is there going to be MPI warrant again?"
"https://klse.i3investor.com/servlets/forum/800000623.jsp?ftp=37","Sep 26, 2019 2:46 PM","Icon8888","RM13 within two years"
"https://klse.i3investor.com/servlets/forum/800000623.jsp?ftp=37","Sep 26, 2019 3:55 PM","RainT","@icon8888
only RM13?
I expect RM15"
"https://klse.i3investor.com/servlets/forum/800000623.jsp?ftp=37","Oct 4, 2019 8:52 AM","VennesA","MPI never fail"
"https://klse.i3investor.com/servlets/forum/800000623.jsp?ftp=37","Oct 4, 2019 3:55 PM","Icon8888","Nice
This s is just the beginning
See you at 13"
"https://klse.i3investor.com/servlets/forum/800000623.jsp?ftp=37","Oct 4, 2019 4:14 PM","Endgame","The King return!"
"https://klse.i3investor.com/servlets/forum/800000623.jsp?ftp=37","Oct 4, 2019 4:15 PM","Endgame","Just sai lang... Worst is over for tech"
"https://klse.i3investor.com/servlets/forum/800000623.jsp?ftp=37","Oct 4, 2019 4:33 PM","Wong Chee Siong","Already Sailang, averange price @ RM8.5, tp RM16 within 6-9 month."
"https://klse.i3investor.com/servlets/forum/800000623.jsp?ftp=37","Oct 4, 2019 6:10 PM","CraZY INvesTOR","carsem keep buying machine from vitrox, i think their expansion plan going quite okay."
"https://klse.i3investor.com/servlets/forum/800000623.jsp?ftp=37","Oct 5, 2019 9:05 AM","Wong Chee Siong","Carsem also also using Penta machine.
PENTAMASTER PM6322 4 SOICN
PM3510 4 MLP, SC70, SOT23, SOICN
PM4200 4 DDPAK"
"https://klse.i3investor.com/servlets/forum/800000623.jsp?ftp=37","Oct 7, 2019 9:23 AM","Endgame","Limit up!!!"
"https://klse.i3investor.com/servlets/forum/800000623.jsp?ftp=37","Oct 7, 2019 10:27 AM","Icon8888","I have 3 lorries"
"https://klse.i3investor.com/servlets/forum/800000623.jsp?ftp=37","Oct 7, 2019 10:42 AM","Wong Chee Siong","Next tp:RM11 and RM13.5"
"https://klse.i3investor.com/servlets/forum/800000623.jsp?ftp=37","Oct 7, 2019 10:52 AM","pang72","I had not much but Pls limit up"
"https://klse.i3investor.com/servlets/forum/800000623.jsp?ftp=37","Oct 7, 2019 12:10 PM","Endgame","9.88"
"https://klse.i3investor.com/servlets/forum/800000623.jsp?ftp=37","Oct 7, 2019 12:11 PM","Endgame","Don't miss the boat!"
"https://klse.i3investor.com/servlets/forum/800000623.jsp?ftp=37","Oct 7, 2019 12:11 PM","Endgame","Tp 20.80"
"https://klse.i3investor.com/servlets/forum/800000623.jsp?ftp=37","Oct 7, 2019 5:50 PM","RainT","@wongcheesiong
wah RM16???
sure bo?
dont expeect too high , as you will be disappointed"
"https://klse.i3investor.com/servlets/forum/800000623.jsp?ftp=37","Oct 7, 2019 7:50 PM","PotentialGhost","14.00 not a problem"
"https://klse.i3investor.com/servlets/forum/800000623.jsp?ftp=37","Oct 8, 2019 8:48 AM","WallStreetInsider","Big news coming soon. hint hint acquis........E.......M......S"
"https://klse.i3investor.com/servlets/forum/800000623.jsp?ftp=37","Oct 8, 2019 12:33 PM","Wong Chee Siong","Superb under value, all tech stock is at PE20 and above, let say MPI can maintain EPS60sen/4quarter,should get RM12 stock price. If next 4 quarter can get EPS80sen @ PE20,stock price should hit $16, even PE16 which same as now, also get RM12.8, unless EPS continuously down. Anyway, can hold this stock until result is out and after AGM by next month, take a look prospect given by management and i think should have dividend which refer to last few year record. Anyone attend next month AGM, can ask management any planning for that 700million cash, lol."
"https://klse.i3investor.com/servlets/forum/800000623.jsp?ftp=37","Oct 9, 2019 4:09 PM","monetary","support huawei. buy some mpi."
"https://klse.i3investor.com/servlets/forum/800000623.jsp?ftp=37","Oct 9, 2019 4:56 PM","monetary","hope it follow unisem footsteps. racing to pe24 in 4days."
"https://klse.i3investor.com/servlets/forum/800000623.jsp?ftp=37","Oct 11, 2019 11:59 AM","Icon8888","RM10 very soon"
"https://klse.i3investor.com/servlets/forum/800000623.jsp?ftp=37","Oct 11, 2019 12:20 PM","monetary","Need share split or bonus issue. Too illiquid. Should increase div payout."
"https://klse.i3investor.com/servlets/forum/800000623.jsp?ftp=37","Oct 11, 2019 4:21 PM","monetary","kikiki....."
